{
	"name": "Multipart file upload exceeds limit",
	"description": "Multipart file upload exceeding limit returns 413",
	"category": "body_size_limit",
	"handler": {
		"route": "/api/upload/avatar",
		"method": "POST",
		"middleware": {
			"body_size_limit": {
				"max_body_size_bytes": 1048576
			}
		}
	},
	"request": {
		"method": "POST",
		"path": "/api/upload/avatar",
		"headers": {
			"Content-Type": "multipart/form-data; boundary=----WebKitFormBoundary7MA4YWxkTrZu0gW",
			"Content-Length": "2097152"
		},
		"body": {
			"simulated_size_bytes": 2097152
		}
	},
	"expected_response": {
		"status_code": 413,
		"body": {
			"type": "https://spikard.dev/errors/payload-too-large",
			"title": "Payload Too Large",
			"status": 413,
			"detail": "Request body size (2097152 bytes) exceeds maximum allowed size (1048576 bytes)"
		}
	},
	"tags": ["body_size_limit", "middleware", "413", "multipart", "upload", "content-type"],
	"notes": "2MB multipart upload exceeding 1MB limit (typical for avatar uploads)"
}
