{
	"name": "test_header_params_005",
	"description": "Extracted from Litestar: test_header_params case 5",
	"category": "query_params",
	"source": {
		"framework": "litestar",
		"test_file": "tests/unit/test_kwargs/test_header_params.py",
		"test_function": "test_header_params",
		"adapted": true
	},
	"handler": {
		"route": "/",
		"method": "GET",
		"parameters": {
			"query": {
				"special_header": {
					"type": "string",
					"annotation": "t_type"
				}
			}
		}
	},
	"request": {
		"method": "GET",
		"path": "/"
	},
	"expected_response": {
		"status_code": 400,
		"validation_errors": []
	},
	"tags": ["validation", "error", "query"]
}
