{
	"name": "Streaming body exceeds limit",
	"description": "Streaming request body exceeding limit returns 413 during stream processing",
	"category": "body_size_limit",
	"handler": {
		"route": "/api/stream",
		"method": "POST",
		"middleware": {
			"body_size_limit": {
				"max_body_size_bytes": 8192
			}
		}
	},
	"request": {
		"method": "POST",
		"path": "/api/stream",
		"headers": {
			"Content-Type": "application/octet-stream",
			"Transfer-Encoding": "chunked"
		},
		"body": {
			"simulated_size_bytes": 16384
		}
	},
	"expected_response": {
		"status_code": 413,
		"body": {
			"type": "https://spikard.dev/errors/payload-too-large",
			"title": "Payload Too Large",
			"status": 413,
			"detail": "Request body size (16384 bytes) exceeds maximum allowed size (8192 bytes)"
		}
	},
	"tags": ["body_size_limit", "middleware", "413", "streaming", "chunked", "content-type"],
	"notes": "Chunked transfer encoding with body exceeding 8KB limit, detected during streaming"
}
