{
  "name": "Optional APIKey cookie - missing",
  "description": "Tests optional APIKeyCookie (auto_error=False) returns None without 403",
  "source": {
    "framework": "fastapi",
    "test_file": "tests/test_security_api_key_cookie_optional.py",
    "test_function": "test_security_api_key_no_key"
  },
  "request": {
    "method": "GET",
    "path": "/users/me"
  },
  "expected_response": {
    "status_code": 200,
    "body": {
      "msg": "Create an account first"
    }
  },
  "notes": "Optional API key cookie returns None without raising 403 error"
}
